{
  "arm": "reference-8b-q4_k_m",
  "suite": "ct-bench-demo-v1",
  "config": { "thinking": false, "max_gen_toks": 2048, "temperature": 0 },
  "metrics": { "reasoning": { "score": 0.625, "n": 80 }, "code": { "score": 0.55, "n": 40 } },
  "ts": "2026-10-20T08:00:00Z",
  "hardware": { "gpu": "Example GPU, 24 GiB", "runtime": "fixture" }
}
